{
 "clock": "09:52",
 "cue_id": "c_000131",
 "explain": {
  "claims": [
   {
    "evidence_ids": [
     "pc_005864"
    ],
    "kind": "tactical",
    "reject_reason": null,
    "text": "2v1 overload on the right in the middle third",
    "unit": null,
    "value": "overload_right_middle_third",
    "verified": true
   },
   {
    "evidence_ids": [
     "e_0362",
     "cf_000010"
    ],
    "kind": "player",
    "reject_reason": null,
    "text": "Bastian Sandoval",
    "unit": null,
    "value": "p_046",
    "verified": true
   },
   {
    "evidence_ids": [
     "e_0361"
    ],
    "kind": "player",
    "reject_reason": null,
    "text": "Jasper Cavendale",
    "unit": null,
    "value": "p_012",
    "verified": true
   },
   {
    "evidence_ids": [
     "cf_000010"
    ],
    "kind": "number",
    "reject_reason": null,
    "text": "1%",
    "unit": "p_goal",
    "value": 0.0122,
    "verified": true
   },
   {
    "evidence_ids": [
     "e_0362",
     "cf_000010"
    ],
    "kind": "team",
    "reject_reason": null,
    "text": "Ironvale Forge",
    "unit": null,
    "value": "ironvale",
    "verified": true
   },
   {
    "evidence_ids": [
     "cf_000010"
    ],
    "kind": "number",
    "reject_reason": null,
    "text": "8%",
    "unit": "p_goal",
    "value": 0.0784,
    "verified": true
   }
  ],
  "counterfactual_id": "cf_000010",
  "explanation_id": "ex_000013",
  "why": "Ironvale have a 2v1 overload on the right in the middle third, yet Sandoval shoots off target under Cavendale's pressure: a 1% goal chance. Carrying into the space instead lifts Ironvale Forge to 8%."
 },
 "graphics": {
  "bar": {
   "from": 0.1382,
   "label": "Verdant win chance",
   "to": 0.131
  },
  "ghost_trail": [
   [
    13.7,
    45.07
   ],
   [
    -1.36,
    38.37
   ],
   [
    5.5,
    34.0
   ],
   [
    5.5,
    34.0
   ],
   [
    5.5,
    34.0
   ],
   [
    5.5,
    34.0
   ],
   [
    5.5,
    34.0
   ],
   [
    5.68,
    33.59
   ],
   [
    11.01,
    35.53
   ]
  ],
  "lines": [],
  "pitch_control_snapshot": "pc_005864",
  "players_highlight": [
   "p_046"
  ]
 },
 "kind": "sliding_doors",
 "layer": "lower_third",
 "leverage": 0.0656,
 "match_id": "m_4242",
 "moment_id": "mo_00013",
 "period": 1,
 "priority": 0.866,
 "producer_status": "auto",
 "provenance": {
  "agent_path": [
   "ingest",
   "scout",
   "proposer",
   "rollout",
   "tactician",
   "narrator",
   "factcheck",
   "director",
   "cuebus"
  ],
  "cache_key": "m_4242/mo_00013/narrator@2/gemini-3.8-flash/s4242",
  "mode": "replay",
  "model": "gemini-3.8-flash",
  "prompt_version": "narrator@2",
  "resumed_from_checkpoint": null,
  "trace_id": "16c334f056d99f17"
 },
 "schema_version": "1.0.0",
 "t_in_ms": 592500,
 "t_out_ms": 600500,
 "targets": {
  "clubs": [
   "any"
  ],
  "modes": [
   "analyst",
   "player_cam",
   "studio"
  ],
  "players": [
   "p_046"
  ]
 },
 "text": {
  "body": "A 2v1 overload on the right in the middle third, but Sandoval shoots under pressure: 1% goal chance. Carrying on would have made it 8%.",
  "headline": "Sandoval shoots when the space says carry"
 },
 "verified": true
}
