{
 "clock": "34:25",
 "cue_id": "c_000462",
 "explain": {
  "claims": [],
  "counterfactual_id": null,
  "explanation_id": null,
  "why": "The pundits agree that Sandoval chose to shoot in transition after winning possession. They disagree sharply on whether shooting immediately was the correct decision or if Sandoval should have sought a passing option to retain territory."
 },
 "graphics": {
  "lines": [],
  "players_highlight": []
 },
 "kind": "sliding_doors",
 "layer": "options_card",
 "leverage": 0.081,
 "match_id": "m_4242",
 "moment_id": "mo_00046",
 "period": 1,
 "priority": 0.881,
 "producer_status": "auto",
 "provenance": {
  "agent_path": [
   "ingest",
   "scout",
   "panel",
   "factcheck",
   "director",
   "cuebus"
  ],
  "cache_key": null,
  "mode": "replay",
  "model": "gemini-3.8-flash",
  "prompt_version": "chair@1",
  "resumed_from_checkpoint": null,
  "trace_id": "c737cef24d46c115"
 },
 "schema_version": "1.0.0",
 "t_in_ms": 2065200,
 "t_out_ms": 2073200,
 "targets": {
  "clubs": [
   "any"
  ],
  "modes": [
   "analyst",
   "player_cam",
   "studio"
  ],
  "players": [
   "p_046"
  ]
 },
 "text": {
  "body": "The pundits agree that Sandoval chose to shoot in transition after winning possession. They disagree sharply on whether shooting immediately was the correct decision or if Sandoval should have sought a passing option to retain territory.",
  "headline": "Debate Over Sandoval Shot in Transition"
 },
 "verified": true
}
