{
 "clock": "08:21",
 "cue_id": "c_000122",
 "explain": {
  "claims": [],
  "counterfactual_id": null,
  "explanation_id": null,
  "why": "The pundits agree that Bastian Sandoval shot immediately after a turnover rather than opting for an extra pass. The central dispute is whether Sandoval should have sought an extra pass to sustain control or taken the shot directly to exploit the transition."
 },
 "graphics": {
  "lines": [],
  "players_highlight": []
 },
 "kind": "sliding_doors",
 "layer": "options_card",
 "leverage": 0.2639,
 "match_id": "m_4242",
 "moment_id": "mo_00012",
 "period": 1,
 "priority": 1.0,
 "producer_status": "auto",
 "provenance": {
  "agent_path": [
   "ingest",
   "scout",
   "panel",
   "factcheck",
   "director",
   "cuebus"
  ],
  "cache_key": null,
  "mode": "replay",
  "model": "gemini-3.8-flash",
  "prompt_version": "chair@1",
  "resumed_from_checkpoint": null,
  "trace_id": "00c3598de5a56bac"
 },
 "schema_version": "1.0.0",
 "t_in_ms": 501400,
 "t_out_ms": 509400,
 "targets": {
  "clubs": [
   "any"
  ],
  "modes": [
   "analyst",
   "casual",
   "player_cam",
   "studio"
  ],
  "players": [
   "p_001",
   "p_046"
  ]
 },
 "text": {
  "body": "The pundits agree that Bastian Sandoval shot immediately after a turnover rather than opting for an extra pass. The central dispute is whether Sandoval should have sought an extra pass to sustain control or taken the shot directly to exploit the transition.",
  "headline": "Debate over Sandoval's quick shot"
 },
 "verified": true
}
