{
 "clock": "67:32",
 "cue_id": "c_902763",
 "explain": {
  "claims": [
   {
    "evidence_ids": [
     "e_2763"
    ],
    "kind": "player",
    "reject_reason": null,
    "text": "Hartigan",
    "unit": null,
    "value": "p_025",
    "verified": true
   }
  ],
  "counterfactual_id": null,
  "explanation_id": null,
  "why": "Contact point (4.9, 43.8) inside the penalty area."
 },
 "graphics": {
  "bar": null,
  "ghost_trail": [],
  "lines": [
   [
    [
     0.0,
     13.84
    ],
    [
     16.5,
     13.84
    ]
   ],
   [
    [
     16.5,
     13.84
    ],
    [
     16.5,
     54.16
    ]
   ],
   [
    [
     16.5,
     54.16
    ],
    [
     0.0,
     54.16
    ]
   ]
  ],
  "pitch_control_snapshot": null,
  "players_highlight": [
   "p_025",
   "p_021"
  ]
 },
 "kind": "fourth_official",
 "layer": "referee_line",
 "leverage": null,
 "match_id": "m_4242",
 "moment_id": null,
 "period": 2,
 "priority": 0.7,
 "producer_status": "auto",
 "provenance": {
  "agent_path": [
   "scout",
   "fourth_official",
   "director"
  ],
  "cache_key": null,
  "mode": "replay",
  "model": null,
  "prompt_version": null,
  "resumed_from_checkpoint": null,
  "trace_id": "fo_004052500"
 },
 "schema_version": "1.0.0",
 "t_in_ms": 4052500,
 "t_out_ms": 4060500,
 "targets": {
  "clubs": [
   "any"
  ],
  "modes": [
   "analyst",
   "casual",
   "player_cam",
   "studio"
  ],
  "players": [
   "p_025",
   "p_021"
  ]
 },
 "text": {
  "body": "Contact inside the penalty area; Hartigan closed in at 1.0 m/s.",
  "headline": "Penalty: Hartigan"
 },
 "verified": true
}
